{
  "case_id": "PER-POLICY-002",
  "case_name": "Peripheral USB Storage Policy Roundtrip",
  "module": "peripheral",
  "started_at": "2026-09-02T02:46:57+00:00",
  "finished_at": "2026-09-02T02:47:20+00:00",
  "status": "FAIL",
  "failure_code": "MCP_EXECUTION_FAILED",
  "failure_stage": "open_peripheral_manage",
  "primary_evidence": {
    "type": "step_failure",
    "step_name": "open_peripheral_manage",
    "failure_code": "MCP_EXECUTION_FAILED",
    "message": "Failed to click sidebar item sidebar-nav-peripheral-manage"
  },
  "secondary_evidence": [
    {
      "step_name": "launch_app",
      "wakeup": {
        "returncode": 0,
        "stdout": "WakeupDevice is called",
        "stderr": ""
      },
      "password_prompt": {
        "status": "PASS",
        "failure_code": "",
        "message": "Auth prompt handled",
        "handled": false,
        "prompt_detected": false,
        "evidence": {
          "type": "mcp_action",
          "action": "__driver_input_password_if_prompted",
          "params": {
            "bundle_name": "com.huawei.securitytool",
            "timeout_ms": 4000
          },
          "expected": "Clear lock screen password prompt when present",
          "prompt_detected": false,
          "handled": false,
          "still_present": false,
          "execution_backend": "real_bridge",
          "bridge_command": "python scripts\\e2e\\bridges\\harmonyos_mcp_bridge.py",
          "bridge": "harmonyos_mcp_bridge",
          "backend_module": "scripts\\e2e\\bridges\\real_harmonyos_mcp_backend.py",
          "bridge_backend": "real_harmonyos_mcp_backend"
        }
      }
    }
  ],
  "steps": [
    {
      "name": "launch_app",
      "step_type": "flow_action",
      "status": "PASS",
      "started_at": "2026-09-02T02:46:57+00:00",
      "finished_at": "2026-09-02T02:47:07+00:00",
      "failure_code": "",
      "command": "hdc -t 3QC0124C11000711 shell aa start -a EntryAbility -b com.huawei.securitytool -m entry",
      "returncode": 0,
      "stdout": "start ability successfully.",
      "stderr": "",
      "message": "Flow executed",
      "evidence": {
        "wakeup": {
          "returncode": 0,
          "stdout": "WakeupDevice is called",
          "stderr": ""
        },
        "password_prompt": {
          "status": "PASS",
          "failure_code": "",
          "message": "Auth prompt handled",
          "handled": false,
          "prompt_detected": false,
          "evidence": {
            "type": "mcp_action",
            "action": "__driver_input_password_if_prompted",
            "params": {
              "bundle_name": "com.huawei.securitytool",
              "timeout_ms": 4000
            },
            "expected": "Clear lock screen password prompt when present",
            "prompt_detected": false,
            "handled": false,
            "still_present": false,
            "execution_backend": "real_bridge",
            "bridge_command": "python scripts\\e2e\\bridges\\harmonyos_mcp_bridge.py",
            "bridge": "harmonyos_mcp_bridge",
            "backend_module": "scripts\\e2e\\bridges\\real_harmonyos_mcp_backend.py",
            "bridge_backend": "real_harmonyos_mcp_backend"
          }
        }
      }
    },
    {
      "name": "open_peripheral_manage",
      "step_type": "flow_action",
      "status": "FAIL",
      "started_at": "2026-09-02T02:47:07+00:00",
      "finished_at": "2026-09-02T02:47:20+00:00",
      "failure_code": "MCP_EXECUTION_FAILED",
      "command": "python scripts\\e2e\\bridges\\harmonyos_mcp_bridge.py",
      "returncode": null,
      "stdout": null,
      "stderr": null,
      "message": "Failed to click sidebar item sidebar-nav-peripheral-manage",
      "evidence": {
        "type": "mcp_action",
        "action": "navigate_page",
        "params": {
          "page_id": "peripheral-manage"
        },
        "expected": "Navigate to page peripheral-manage",
        "click_result": {},
        "page_text": "外设管理",
        "marker_text": "接口管控",
        "sidebar_node": {
          "type": "Row",
          "text": "",
          "id": "218",
          "x": 495,
          "y": 711,
          "left": 320,
          "top": 669,
          "width": 350,
          "height": 84,
          "checked": false,
          "clickable": true,
          "properties": {
            "text": "",
            "ID": "218",
            "compid": "211:218",
            "left": 320,
            "top": 669,
            "width": 350,
            "height": 84,
            "visible": true,
            "clickable": true,
            "enabled": true,
            "focused": false,
            "scrollable": false,
            "checked": false,
            "description": "",
            "bundleName": "",
            "pagePath": ""
          }
        },
        "execution_backend": "real_bridge",
        "bridge_command": "python scripts\\e2e\\bridges\\harmonyos_mcp_bridge.py",
        "bridge": "harmonyos_mcp_bridge",
        "backend_module": "scripts\\e2e\\bridges\\real_harmonyos_mcp_backend.py",
        "bridge_backend": "real_harmonyos_mcp_backend"
      }
    }
  ],
  "artifacts": [],
  "notes": [
    "This adapter is the reference implementation inside the business repository.",
    "The structure is designed so core modules can be extracted into a standalone repository later.",
    "Registered pages: dashboard, firewall, firewall-rules, log-manage, peripheral-manage, identity, tool-settings, help-feedback",
    "This performs a policy change and restores the USB storage policy to the less restrictive allow state."
  ],
  "result_policy": {
    "allow_unknown": true,
    "stop_on_failure": true
  },
  "environment_snapshot": {
    "project_id": "security_tool",
    "adapter_name": "security_tool",
    "adapter_version": "1.0.0",
    "bundle_name": "com.huawei.securitytool",
    "device_id": "3QC0124C11000711",
    "mode": "completeness",
    "connected": true,
    "page_registry_version": "2026-04-09"
  }
}