{
  "case_id": "PER-USB-BLACKLIST-001",
  "case_name": "Peripheral USB Blacklist Add",
  "module": "peripheral",
  "started_at": "2026-03-13T02:54:09+00:00",
  "finished_at": "2026-03-13T02:55:32+00:00",
  "status": "FAIL",
  "failure_code": "MCP_EXECUTION_FAILED",
  "failure_stage": "add_usb_blacklist_item",
  "primary_evidence": {
    "type": "step_failure",
    "step_name": "add_usb_blacklist_item",
    "failure_code": "MCP_EXECUTION_FAILED",
    "message": "No text inputs were detected"
  },
  "secondary_evidence": [
    {
      "step_name": "launch_app",
      "password_prompt": {
        "status": "PASS",
        "failure_code": "",
        "message": "Auth prompt handled",
        "handled": false,
        "prompt_detected": false,
        "evidence": {
          "type": "mcp_action",
          "action": "__driver_input_password_if_prompted",
          "params": {
            "bundle_name": "com.huawei.securitytool",
            "timeout_ms": 4000
          },
          "expected": "Clear lock screen password prompt when present",
          "prompt_detected": false,
          "handled": false,
          "still_present": false
        }
      }
    },
    {
      "step_name": "open_peripheral_manage",
      "type": "mcp_action",
      "action": "navigate_page",
      "params": {
        "page_id": "peripheral-manage"
      },
      "expected": "Navigate to page peripheral-manage",
      "bridge_backend": "real_harmonyos_mcp_backend",
      "action_plan": {
        "goal": "Open a page from the left navigation rail.",
        "required_params": [
          "page_id"
        ],
        "mcp_tools": [
          "find_element",
          "click_element",
          "wait_element"
        ],
        "steps": [
          "Resolve the target page title from the adapter page registry.",
          "Find the navigation item by text or stable page locator.",
          "Click the navigation item.",
          "Wait for the page title or a page-specific anchor text to appear."
        ]
      }
    },
    {
      "step_name": "open_usb_blacklist_dialog",
      "type": "mcp_action",
      "action": "open_usb_blacklist_dialog",
      "params": {},
      "expected": "USB blacklist dialog is visible",
      "bridge_backend": "real_harmonyos_mcp_backend",
      "action_plan": {
        "goal": "Open the USB blacklist dialog.",
        "required_params": [],
        "mcp_tools": [
          "find_element",
          "click_element",
          "wait_element"
        ],
        "steps": [
          "Locate the USB blacklist entry point.",
          "Open the add dialog.",
          "Wait for the dialog to be visible."
        ]
      }
    }
  ],
  "steps": [
    {
      "name": "launch_app",
      "step_type": "flow_action",
      "status": "PASS",
      "started_at": "2026-03-13T02:54:09+00:00",
      "finished_at": "2026-03-13T02:54:15+00:00",
      "failure_code": "",
      "command": "hdc -t 3QC0124C11000711 shell aa start -a EntryAbility -b com.huawei.securitytool -m entry",
      "returncode": 0,
      "stdout": "start ability successfully.",
      "stderr": "",
      "message": "Flow executed",
      "evidence": {
        "password_prompt": {
          "status": "PASS",
          "failure_code": "",
          "message": "Auth prompt handled",
          "handled": false,
          "prompt_detected": false,
          "evidence": {
            "type": "mcp_action",
            "action": "__driver_input_password_if_prompted",
            "params": {
              "bundle_name": "com.huawei.securitytool",
              "timeout_ms": 4000
            },
            "expected": "Clear lock screen password prompt when present",
            "prompt_detected": false,
            "handled": false,
            "still_present": false
          }
        }
      }
    },
    {
      "name": "open_peripheral_manage",
      "step_type": "flow_action",
      "status": "UNKNOWN",
      "started_at": "2026-03-13T02:54:15+00:00",
      "finished_at": "2026-03-13T02:54:45+00:00",
      "failure_code": "MCP_ACTION_PENDING",
      "command": null,
      "returncode": null,
      "stdout": null,
      "stderr": null,
      "message": "Navigation click succeeded but page marker did not resolve for peripheral-manage",
      "evidence": {
        "type": "mcp_action",
        "action": "navigate_page",
        "params": {
          "page_id": "peripheral-manage"
        },
        "expected": "Navigate to page peripheral-manage",
        "bridge_backend": "real_harmonyos_mcp_backend",
        "action_plan": {
          "goal": "Open a page from the left navigation rail.",
          "required_params": [
            "page_id"
          ],
          "mcp_tools": [
            "find_element",
            "click_element",
            "wait_element"
          ],
          "steps": [
            "Resolve the target page title from the adapter page registry.",
            "Find the navigation item by text or stable page locator.",
            "Click the navigation item.",
            "Wait for the page title or a page-specific anchor text to appear."
          ]
        }
      }
    },
    {
      "name": "open_usb_blacklist_dialog",
      "step_type": "flow_action",
      "status": "UNKNOWN",
      "started_at": "2026-03-13T02:54:45+00:00",
      "finished_at": "2026-03-13T02:55:29+00:00",
      "failure_code": "MCP_ACTION_PENDING",
      "command": null,
      "returncode": null,
      "stdout": null,
      "stderr": null,
      "message": "Dialog trigger was not found: USB黑名单/添加 USB 设备黑名单/添加黑名单",
      "evidence": {
        "type": "mcp_action",
        "action": "open_usb_blacklist_dialog",
        "params": {},
        "expected": "USB blacklist dialog is visible",
        "bridge_backend": "real_harmonyos_mcp_backend",
        "action_plan": {
          "goal": "Open the USB blacklist dialog.",
          "required_params": [],
          "mcp_tools": [
            "find_element",
            "click_element",
            "wait_element"
          ],
          "steps": [
            "Locate the USB blacklist entry point.",
            "Open the add dialog.",
            "Wait for the dialog to be visible."
          ]
        }
      }
    },
    {
      "name": "add_usb_blacklist_item",
      "step_type": "flow_action",
      "status": "FAIL",
      "started_at": "2026-03-13T02:55:29+00:00",
      "finished_at": "2026-03-13T02:55:32+00:00",
      "failure_code": "MCP_EXECUTION_FAILED",
      "command": "python scripts/e2e/bridges/harmonyos_mcp_bridge.py",
      "returncode": null,
      "stdout": null,
      "stderr": null,
      "message": "No text inputs were detected",
      "evidence": {
        "type": "mcp_action",
        "action": "add_usb_blacklist",
        "params": {
          "base_class": 8,
          "sub_class": 6,
          "protocol": 80
        },
        "expected": "USB blacklist item is added"
      }
    }
  ],
  "artifacts": [],
  "notes": [
    "This adapter is the reference implementation inside the business repository.",
    "The structure is designed so core modules can be extracted into a standalone repository later.",
    "Registered pages: dashboard, firewall, firewall-rules, log-manage, peripheral-manage, identity, tool-settings",
    "USB blacklist assertion will be attached after service-backed reads are integrated."
  ],
  "result_policy": {
    "allow_unknown": true,
    "stop_on_failure": true
  },
  "environment_snapshot": {
    "project_id": "security_tool",
    "adapter_name": "security_tool",
    "adapter_version": "1.0.0",
    "bundle_name": "com.huawei.securitytool",
    "device_id": "3QC0124C11000711",
    "mode": "completeness",
    "connected": true,
    "page_registry_version": "2026-03-12",
    "compatibility_mode": "declarative"
  }
}