{
  "case_id": "ID-DOMAIN-001",
  "case_name": "Identity Domain Policy Update",
  "module": "identity",
  "started_at": "2026-03-12T13:08:40+00:00",
  "finished_at": "2026-03-12T13:09:10+00:00",
  "status": "FAIL",
  "failure_code": "MCP_EXECUTION_FAILED",
  "failure_stage": "update_domain_policy",
  "primary_evidence": {
    "type": "step_failure",
    "step_name": "update_domain_policy",
    "failure_code": "MCP_EXECUTION_FAILED",
    "message": "No text inputs were detected"
  },
  "secondary_evidence": [
    {
      "step_name": "open_identity_page",
      "type": "mcp_action",
      "action": "navigate_page",
      "params": {
        "page_id": "identity"
      },
      "expected": "Navigate to page identity",
      "page_id": "identity",
      "sidebar_id": "sidebar-nav-identity",
      "route_id": "route-page-identity",
      "page_marker": {
        "query": {
          "text": "身份鉴别",
          "bundle_name": "com.huawei.securitytool"
        },
        "element": {
          "type": "Text",
          "text": "身份鉴别",
          "id": "189",
          "compid": "110:189",
          "top": 885,
          "left": 546,
          "width": 107,
          "height": 31,
          "x": 599,
          "y": 900,
          "visible": true,
          "clickable": false,
          "depth": 10,
          "bounds": {
            "left": 546,
            "top": 885,
            "right": 653,
            "bottom": 916
          },
          "element_handle": {
            "window_id": 110,
            "id": "189",
            "compid": "110:189",
            "type": "Text",
            "text": "身份鉴别",
            "x": 599,
            "y": 900,
            "bounds": {
              "left": 546,
              "top": 885,
              "right": 653,
              "bottom": 916
            },
            "bundle_name": "com.huawei.securitytool"
          }
        }
      }
    }
  ],
  "steps": [
    {
      "name": "launch_app",
      "step_type": "flow_action",
      "status": "PASS",
      "started_at": "2026-03-12T13:08:40+00:00",
      "finished_at": "2026-03-12T13:08:41+00:00",
      "failure_code": "",
      "command": "hdc -t 3QC0124C11000711 shell aa start -a EntryAbility -b com.huawei.securitytool -m entry",
      "returncode": 0,
      "stdout": "start ability successfully.",
      "stderr": "",
      "message": "Flow executed",
      "evidence": {}
    },
    {
      "name": "open_identity_page",
      "step_type": "flow_action",
      "status": "PASS",
      "started_at": "2026-03-12T13:08:41+00:00",
      "finished_at": "2026-03-12T13:09:04+00:00",
      "failure_code": "",
      "command": "python scripts\\\\e2e\\\\bridges\\\\harmonyos_mcp_bridge.py",
      "returncode": null,
      "stdout": null,
      "stderr": null,
      "message": "Navigation completed",
      "evidence": {
        "type": "mcp_action",
        "action": "navigate_page",
        "params": {
          "page_id": "identity"
        },
        "expected": "Navigate to page identity",
        "page_id": "identity",
        "sidebar_id": "sidebar-nav-identity",
        "route_id": "route-page-identity",
        "page_marker": {
          "query": {
            "text": "身份鉴别",
            "bundle_name": "com.huawei.securitytool"
          },
          "element": {
            "type": "Text",
            "text": "身份鉴别",
            "id": "189",
            "compid": "110:189",
            "top": 885,
            "left": 546,
            "width": 107,
            "height": 31,
            "x": 599,
            "y": 900,
            "visible": true,
            "clickable": false,
            "depth": 10,
            "bounds": {
              "left": 546,
              "top": 885,
              "right": 653,
              "bottom": 916
            },
            "element_handle": {
              "window_id": 110,
              "id": "189",
              "compid": "110:189",
              "type": "Text",
              "text": "身份鉴别",
              "x": 599,
              "y": 900,
              "bounds": {
                "left": 546,
                "top": 885,
                "right": 653,
                "bottom": 916
              },
              "bundle_name": "com.huawei.securitytool"
            }
          }
        }
      }
    },
    {
      "name": "update_domain_policy",
      "step_type": "flow_action",
      "status": "FAIL",
      "started_at": "2026-03-12T13:09:04+00:00",
      "finished_at": "2026-03-12T13:09:10+00:00",
      "failure_code": "MCP_EXECUTION_FAILED",
      "command": "python scripts\\\\e2e\\\\bridges\\\\harmonyos_mcp_bridge.py",
      "returncode": null,
      "stdout": null,
      "stderr": null,
      "message": "No text inputs were detected",
      "evidence": {
        "type": "mcp_action",
        "action": "update_domain_account_policy",
        "params": {
          "password_max_age_days": 90,
          "expiration_notify_days": 7,
          "auth_validity_minutes": -1
        },
        "expected": "Identity domain policy is updated"
      }
    }
  ],
  "artifacts": [],
  "notes": [
    "This adapter is the reference implementation inside the business repository.",
    "The structure is designed so core modules can be extracted into a standalone repository later.",
    "Registered pages: dashboard, firewall, firewall-rules, log-manage, peripheral-manage, identity, tool-settings",
    "Getter-backed domain policy assertion will be added later."
  ],
  "result_policy": {
    "allow_unknown": true,
    "stop_on_failure": true
  },
  "environment_snapshot": {
    "project_id": "security_tool",
    "adapter_name": "security_tool",
    "adapter_version": "1.0.0",
    "bundle_name": "com.huawei.securitytool",
    "device_id": "3QC0124C11000711",
    "mode": "completeness",
    "connected": true,
    "page_registry_version": "2026-03-12",
    "compatibility_mode": "declarative"
  }
}