{
  "case_id": "LOG-EXPORT-001",
  "case_name": "Log Export Flow",
  "module": "log-manage",
  "started_at": "2026-03-12T13:03:47+00:00",
  "finished_at": "2026-03-12T13:04:52+00:00",
  "status": "PASS",
  "failure_code": "",
  "failure_stage": "",
  "primary_evidence": {
    "type": "step_success",
    "step_name": "export_logs",
    "message": "Log export flow triggered"
  },
  "secondary_evidence": [
    {
      "step_name": "open_log_manage",
      "type": "mcp_action",
      "action": "navigate_page",
      "params": {
        "page_id": "log-manage"
      },
      "expected": "Navigate to page log-manage",
      "page_id": "log-manage",
      "sidebar_id": "sidebar-nav-log-manage",
      "route_id": "route-page-log-manage",
      "page_marker": {
        "query": {
          "text": "日志管理",
          "bundle_name": "com.huawei.securitytool"
        },
        "element": {
          "type": "Text",
          "text": "日志管理",
          "id": "181",
          "compid": "110:181",
          "top": 702,
          "left": 546,
          "width": 107,
          "height": 31,
          "x": 599,
          "y": 717,
          "visible": true,
          "clickable": false,
          "depth": 10,
          "bounds": {
            "left": 546,
            "top": 702,
            "right": 653,
            "bottom": 733
          },
          "element_handle": {
            "window_id": 110,
            "id": "181",
            "compid": "110:181",
            "type": "Text",
            "text": "日志管理",
            "x": 599,
            "y": 717,
            "bounds": {
              "left": 546,
              "top": 702,
              "right": 653,
              "bottom": 733
            },
            "bundle_name": "com.huawei.securitytool"
          }
        }
      }
    },
    {
      "step_name": "export_logs",
      "type": "mcp_action",
      "action": "export_logs",
      "params": {},
      "expected": "Log export flow completes"
    }
  ],
  "steps": [
    {
      "name": "launch_app",
      "step_type": "flow_action",
      "status": "PASS",
      "started_at": "2026-03-12T13:03:47+00:00",
      "finished_at": "2026-03-12T13:03:47+00:00",
      "failure_code": "",
      "command": "hdc -t 3QC0124C11000711 shell aa start -a EntryAbility -b com.huawei.securitytool -m entry --ps skip_startup_auth 1",
      "returncode": 0,
      "stdout": "start ability successfully.",
      "stderr": "",
      "message": "Flow executed",
      "evidence": {}
    },
    {
      "name": "open_log_manage",
      "step_type": "flow_action",
      "status": "PASS",
      "started_at": "2026-03-12T13:03:47+00:00",
      "finished_at": "2026-03-12T13:04:18+00:00",
      "failure_code": "",
      "command": "python scripts\\\\e2e\\\\bridges\\\\harmonyos_mcp_bridge.py",
      "returncode": null,
      "stdout": null,
      "stderr": null,
      "message": "Navigation completed",
      "evidence": {
        "type": "mcp_action",
        "action": "navigate_page",
        "params": {
          "page_id": "log-manage"
        },
        "expected": "Navigate to page log-manage",
        "page_id": "log-manage",
        "sidebar_id": "sidebar-nav-log-manage",
        "route_id": "route-page-log-manage",
        "page_marker": {
          "query": {
            "text": "日志管理",
            "bundle_name": "com.huawei.securitytool"
          },
          "element": {
            "type": "Text",
            "text": "日志管理",
            "id": "181",
            "compid": "110:181",
            "top": 702,
            "left": 546,
            "width": 107,
            "height": 31,
            "x": 599,
            "y": 717,
            "visible": true,
            "clickable": false,
            "depth": 10,
            "bounds": {
              "left": 546,
              "top": 702,
              "right": 653,
              "bottom": 733
            },
            "element_handle": {
              "window_id": 110,
              "id": "181",
              "compid": "110:181",
              "type": "Text",
              "text": "日志管理",
              "x": 599,
              "y": 717,
              "bounds": {
                "left": 546,
                "top": 702,
                "right": 653,
                "bottom": 733
              },
              "bundle_name": "com.huawei.securitytool"
            }
          }
        }
      }
    },
    {
      "name": "export_logs",
      "step_type": "flow_action",
      "status": "PASS",
      "started_at": "2026-03-12T13:04:18+00:00",
      "finished_at": "2026-03-12T13:04:52+00:00",
      "failure_code": "",
      "command": "python scripts\\\\e2e\\\\bridges\\\\harmonyos_mcp_bridge.py",
      "returncode": null,
      "stdout": null,
      "stderr": null,
      "message": "Log export flow triggered",
      "evidence": {
        "type": "mcp_action",
        "action": "export_logs",
        "params": {},
        "expected": "Log export flow completes"
      }
    }
  ],
  "artifacts": [],
  "notes": [
    "This adapter is the reference implementation inside the business repository.",
    "The structure is designed so core modules can be extracted into a standalone repository later.",
    "Registered pages: dashboard, firewall, firewall-rules, log-manage, peripheral-manage, identity, tool-settings",
    "Export artifact verification will be attached once filesystem assertions are wired."
  ],
  "result_policy": {
    "allow_unknown": true,
    "stop_on_failure": true
  },
  "environment_snapshot": {
    "project_id": "security_tool",
    "adapter_name": "security_tool",
    "adapter_version": "1.0.0",
    "bundle_name": "com.huawei.securitytool",
    "device_id": "3QC0124C11000711",
    "mode": "completeness",
    "connected": true,
    "page_registry_version": "2026-03-12",
    "compatibility_mode": "declarative"
  }
}