{
  "case_id": "ID-PWD-001",
  "case_name": "Identity Password Policy Update",
  "module": "identity",
  "started_at": "2026-03-12T13:07:59+00:00",
  "finished_at": "2026-03-12T13:08:40+00:00",
  "status": "PASS",
  "failure_code": "",
  "failure_stage": "",
  "primary_evidence": {
    "type": "step_success",
    "step_name": "update_password_policy",
    "message": "Password policy fields updated"
  },
  "secondary_evidence": [
    {
      "step_name": "open_identity_page",
      "type": "mcp_action",
      "action": "navigate_page",
      "params": {
        "page_id": "identity"
      },
      "expected": "Navigate to page identity",
      "page_id": "identity",
      "sidebar_id": "sidebar-nav-identity",
      "route_id": "route-page-identity",
      "page_marker": {
        "query": {
          "text": "身份鉴别",
          "bundle_name": "com.huawei.securitytool"
        },
        "element": {
          "type": "Text",
          "text": "身份鉴别",
          "id": "189",
          "compid": "110:189",
          "top": 885,
          "left": 546,
          "width": 107,
          "height": 31,
          "x": 599,
          "y": 900,
          "visible": true,
          "clickable": false,
          "depth": 10,
          "bounds": {
            "left": 546,
            "top": 885,
            "right": 653,
            "bottom": 916
          },
          "element_handle": {
            "window_id": 110,
            "id": "189",
            "compid": "110:189",
            "type": "Text",
            "text": "身份鉴别",
            "x": 599,
            "y": 900,
            "bounds": {
              "left": 546,
              "top": 885,
              "right": 653,
              "bottom": 916
            },
            "bundle_name": "com.huawei.securitytool"
          }
        }
      }
    },
    {
      "step_name": "update_password_policy",
      "type": "mcp_action",
      "action": "update_password_policy",
      "params": {
        "min_length": 8,
        "require_uppercase": true,
        "require_lowercase": true,
        "require_digit": true,
        "require_special_char": true
      },
      "expected": "Identity password policy is updated",
      "fill": {
        "filled_inputs": [
          {
            "node": {
              "type": "TextInput",
              "text": "",
              "x": 1848,
              "y": 943,
              "left": 1390,
              "top": 909,
              "width": 916,
              "height": 69,
              "checked": false,
              "clickable": true
            },
            "value": "8"
          }
        ]
      }
    }
  ],
  "steps": [
    {
      "name": "launch_app",
      "step_type": "flow_action",
      "status": "PASS",
      "started_at": "2026-03-12T13:07:59+00:00",
      "finished_at": "2026-03-12T13:08:00+00:00",
      "failure_code": "",
      "command": "hdc -t 3QC0124C11000711 shell aa start -a EntryAbility -b com.huawei.securitytool -m entry",
      "returncode": 0,
      "stdout": "start ability successfully.",
      "stderr": "",
      "message": "Flow executed",
      "evidence": {}
    },
    {
      "name": "open_identity_page",
      "step_type": "flow_action",
      "status": "PASS",
      "started_at": "2026-03-12T13:08:00+00:00",
      "finished_at": "2026-03-12T13:08:24+00:00",
      "failure_code": "",
      "command": "python scripts\\\\e2e\\\\bridges\\\\harmonyos_mcp_bridge.py",
      "returncode": null,
      "stdout": null,
      "stderr": null,
      "message": "Navigation completed",
      "evidence": {
        "type": "mcp_action",
        "action": "navigate_page",
        "params": {
          "page_id": "identity"
        },
        "expected": "Navigate to page identity",
        "page_id": "identity",
        "sidebar_id": "sidebar-nav-identity",
        "route_id": "route-page-identity",
        "page_marker": {
          "query": {
            "text": "身份鉴别",
            "bundle_name": "com.huawei.securitytool"
          },
          "element": {
            "type": "Text",
            "text": "身份鉴别",
            "id": "189",
            "compid": "110:189",
            "top": 885,
            "left": 546,
            "width": 107,
            "height": 31,
            "x": 599,
            "y": 900,
            "visible": true,
            "clickable": false,
            "depth": 10,
            "bounds": {
              "left": 546,
              "top": 885,
              "right": 653,
              "bottom": 916
            },
            "element_handle": {
              "window_id": 110,
              "id": "189",
              "compid": "110:189",
              "type": "Text",
              "text": "身份鉴别",
              "x": 599,
              "y": 900,
              "bounds": {
                "left": 546,
                "top": 885,
                "right": 653,
                "bottom": 916
              },
              "bundle_name": "com.huawei.securitytool"
            }
          }
        }
      }
    },
    {
      "name": "update_password_policy",
      "step_type": "flow_action",
      "status": "PASS",
      "started_at": "2026-03-12T13:08:24+00:00",
      "finished_at": "2026-03-12T13:08:40+00:00",
      "failure_code": "",
      "command": "python scripts\\\\e2e\\\\bridges\\\\harmonyos_mcp_bridge.py",
      "returncode": null,
      "stdout": null,
      "stderr": null,
      "message": "Password policy fields updated",
      "evidence": {
        "type": "mcp_action",
        "action": "update_password_policy",
        "params": {
          "min_length": 8,
          "require_uppercase": true,
          "require_lowercase": true,
          "require_digit": true,
          "require_special_char": true
        },
        "expected": "Identity password policy is updated",
        "fill": {
          "filled_inputs": [
            {
              "node": {
                "type": "TextInput",
                "text": "",
                "x": 1848,
                "y": 943,
                "left": 1390,
                "top": 909,
                "width": 916,
                "height": 69,
                "checked": false,
                "clickable": true
              },
              "value": "8"
            }
          ]
        }
      }
    }
  ],
  "artifacts": [],
  "notes": [
    "This adapter is the reference implementation inside the business repository.",
    "The structure is designed so core modules can be extracted into a standalone repository later.",
    "Registered pages: dashboard, firewall, firewall-rules, log-manage, peripheral-manage, identity, tool-settings",
    "Getter-backed assertions will be attached after the identity service read path is wired."
  ],
  "result_policy": {
    "allow_unknown": true,
    "stop_on_failure": true
  },
  "environment_snapshot": {
    "project_id": "security_tool",
    "adapter_name": "security_tool",
    "adapter_version": "1.0.0",
    "bundle_name": "com.huawei.securitytool",
    "device_id": "3QC0124C11000711",
    "mode": "completeness",
    "connected": true,
    "page_registry_version": "2026-03-12",
    "compatibility_mode": "declarative"
  }
}